{
  "version": "1",
  "page_size": {"width_mm": 210.0, "height_mm": 297.0},
  "default_font": "함초롬바탕",
  "questions": [
    {
      "number": 1,
      "stem": "다음 글의 주제로 가장 적절한 것은?",
      "stem_blocks": [
        {"type": "text", "text": "다음 글의 주제로 가장 적절한 것은?"},
        {"type": "text", "text": "환경 오염은 현대 사회의 중요한 문제 중 하나이다. 특히 미세먼지로 인한 공기 질 저하는 우리의 건강에 큰 영향을 미친다."}
      ],
      "choices": [
        {"label": "①", "text": "환경 보호의 중요성을 강조하는 글"},
        {"label": "②", "text": "도시 생활의 편리함을 설명하는 글"},
        {"label": "③", "text": "전통 음식의 역사를 소개하는 글"},
        {"label": "④", "text": "최신 기술의 발전 동향을 분석하는 글"},
        {"label": "⑤", "text": "청소년 진로 탐색의 필요성을 논하는 글"}
      ],
      "media": []
    },
    {
      "number": 2,
      "stem": "다음 그래프에서 알 수 있는 사실로 적절한 것은?",
      "stem_blocks": [
        {"type": "text", "text": "다음 그래프에서 알 수 있는 사실로 적절한 것은?"}
      ],
      "choices": [
        {"label": "①", "text": "2010년 이후 매출이 꾸준히 증가했다"},
        {"label": "②", "text": "2015년에 매출이 가장 높았다"},
        {"label": "③", "text": "2020년 매출은 2010년의 두 배이다"},
        {"label": "④", "text": "2018년부터 매출 증가율이 둔화되었다"},
        {"label": "⑤", "text": "2022년에는 전년 대비 감소했다"}
      ],
      "media": []
    },
    {
      "number": 3,
      "stem": "다음 글의 흐름으로 가장 적절한 것은?",
      "stem_blocks": [
        {"type": "text", "text": "다음 글의 흐름으로 가장 적절한 것은?"}
      ],
      "choices": [
        {"label": "①", "text": "원인 → 결과 → 대책"},
        {"label": "②", "text": "주장 → 근거 → 결론"},
        {"label": "③", "text": "비교 → 분석 → 평가"},
        {"label": "④", "text": "도입 → 전개 → 마무리"},
        {"label": "⑤", "text": "사례 → 일반화 → 적용"}
      ],
      "media": []
    }
  ]
}
